{
  "schema_version": "qt.guarantee_registry.v1",
  "audit_baseline_commit": "d46e40bf55caeea12f4ccbde640c71f271eaf9c4",
  "scope": {
    "phase": "phase_2a_calibration",
    "gate": "gate_2_pending",
    "source_candidate_count": 75,
    "included_candidate_ids": [
      "QT-GC-001",
      "QT-GC-003",
      "QT-GC-004",
      "QT-GC-005",
      "QT-GC-008",
      "QT-GC-009",
      "QT-GC-011",
      "QT-GC-012",
      "QT-GC-013",
      "QT-GC-014",
      "QT-GC-070",
      "QT-GC-073"
    ],
    "whole_system_classification_complete": false
  },
  "guarantees": [
    {
      "id": "QT-GUAR-KNOWN-AT-PREFIX-INVARIANCE",
      "candidate_refs": [
        {
          "id": "QT-GC-001",
          "relation": "equivalent"
        }
      ],
      "title": "Known-at prefix invariance",
      "claim_summary": "Appending facts that become known after a causal prefix does not change outputs already derived for that prefix.",
      "claim_scope": [
        "Backtest and paper causal market-data and runtime output paths represented by the named enforcement and proof references.",
        "Known-at selection and suffix-invariance behavior at the frozen baseline."
      ],
      "failure_semantics": [
        "A future-known fact changes an output for an earlier prefix.",
        "A runtime path reads data before its recorded availability boundary."
      ],
      "wording_constraints": [
        "The current proof denominator is representative rather than repository-wide.",
        "The record does not certify every causal source or output path."
      ],
      "owners": [
        "execution-runtime",
        "market-data"
      ],
      "claim_kind": "safety_invariant",
      "claim_lifecycle": "current",
      "registry_disposition": "partially_enforced",
      "activation_status": "unactivated",
      "activation_decision_refs": [],
      "activation_attestation_refs": [],
      "conformance": "partial",
      "enforcement_maturity": "partial",
      "proof_maturity": "partial",
      "proof_mode": "automated",
      "term_refs": [
        "QT-TERM-014"
      ],
      "authority_refs": [
        {
          "path": "docs/contracts/platform/00_system_contract.md",
          "locator": {
            "kind": "line_range",
            "start": 9,
            "end": 13
          },
          "authority_kind": "normative_platform_contract",
          "source_lifecycle": "active",
          "role": "primary"
        },
        {
          "path": "docs/architecture/decisions/0044-enforce-known-at-prefix-invariance.md",
          "locator": {
            "kind": "line_range",
            "start": 39,
            "end": 70
          },
          "authority_kind": "decision_record",
          "source_lifecycle": "accepted",
          "role": "supporting"
        }
      ],
      "enforcement_refs": [
        {
          "id": "QT-ENF-001",
          "kind": "runtime_guard",
          "path": "src/market_data/requirements.py",
          "locator": {
            "kind": "line_range",
            "start": 403,
            "end": 475
          },
          "coverage": "partial"
        },
        {
          "id": "QT-ENF-002",
          "kind": "runtime_guard",
          "path": "portal/backend/service/market/runtime_market_data.py",
          "locator": {
            "kind": "line_range",
            "start": 213,
            "end": 362
          },
          "coverage": "partial"
        }
      ],
      "finding_refs": [
        "ARCH-COVERAGE-001",
        "CI-TRACE-001"
      ],
      "remediation_status": "pending",
      "remediation_refs": [],
      "replaced_by_ids": []
    },
    {
      "id": "QT-GUAR-CANONICAL-FACT-APPEND-ONLY",
      "candidate_refs": [
        {
          "id": "QT-GC-003",
          "relation": "equivalent"
        }
      ],
      "title": "Canonical Fact append-only revisions",
      "claim_summary": "Canonical Fact corrections append linked immutable revisions rather than mutating or deleting existing revisions.",
      "claim_scope": [
        "Canonical market-data Fact revision allocation and persistence.",
        "Database constraints and repository writes at the frozen baseline."
      ],
      "failure_semantics": [
        "A correction overwrites a prior revision or reuses its revision identity.",
        "An existing canonical revision can be updated or deleted."
      ],
      "wording_constraints": [
        "Direct delete rejection and concurrent allocation still need explicit attested proof.",
        "The claim does not make accepted ADRs normative platform contracts."
      ],
      "owners": [
        "database",
        "market-data"
      ],
      "claim_kind": "safety_invariant",
      "claim_lifecycle": "current",
      "registry_disposition": "partially_enforced",
      "activation_status": "unactivated",
      "activation_decision_refs": [],
      "activation_attestation_refs": [],
      "conformance": "static_aligned",
      "enforcement_maturity": "defense_in_depth",
      "proof_maturity": "partial",
      "proof_mode": "automated",
      "term_refs": [
        "QT-TERM-001",
        "QT-TERM-002",
        "QT-TERM-003",
        "QT-TERM-004"
      ],
      "authority_refs": [
        {
          "path": "docs/architecture/decisions/0050-use-one-canonical-append-only-market-data-store.md",
          "locator": {
            "kind": "line_range",
            "start": 90,
            "end": 100
          },
          "authority_kind": "decision_record",
          "source_lifecycle": "accepted",
          "role": "primary"
        },
        {
          "path": "docs/architecture/decisions/0063-use-schema-registered-canonical-facts.md",
          "locator": {
            "kind": "line_range",
            "start": 76,
            "end": 91
          },
          "authority_kind": "decision_record",
          "source_lifecycle": "accepted",
          "role": "supporting"
        }
      ],
      "enforcement_refs": [
        {
          "id": "QT-ENF-003",
          "kind": "database_constraint",
          "path": "portal/backend/db/session.py",
          "locator": {
            "kind": "line_range",
            "start": 840,
            "end": 903
          },
          "coverage": "complete"
        },
        {
          "id": "QT-ENF-004",
          "kind": "database_constraint",
          "path": "portal/backend/db/market_data_models.py",
          "locator": {
            "kind": "line_range",
            "start": 180,
            "end": 201
          },
          "coverage": "supporting"
        },
        {
          "id": "QT-ENF-005",
          "kind": "workflow_gate",
          "path": "portal/backend/service/storage/repos/market_data.py",
          "locator": {
            "kind": "line_range",
            "start": 1948,
            "end": 2070
          },
          "coverage": "supporting"
        }
      ],
      "finding_refs": [
        "SCHEMA-AUTH-001"
      ],
      "remediation_status": "pending",
      "remediation_refs": [],
      "replaced_by_ids": []
    },
    {
      "id": "QT-GUAR-PROVIDER-FREE-CANONICAL-READS",
      "candidate_refs": [
        {
          "id": "QT-GC-004",
          "relation": "equivalent"
        }
      ],
      "title": "Provider-free canonical reads",
      "claim_summary": "Canonical read paths use persisted facts and do not invoke provider transport; acquisition remains explicit.",
      "claim_scope": [
        "Canonical feed and structured-Fact read entrypoints represented by the proof catalog.",
        "Market-data read-versus-acquisition boundary."
      ],
      "failure_semantics": [
        "A canonical read calls a provider or substitutes acquisition for missing stored data.",
        "A read result is synthesized from provider transport instead of canonical storage."
      ],
      "wording_constraints": [
        "Repository-wide entrypoint closure remains a proof gap.",
        "The claim is limited to canonical reads and does not prohibit explicit acquisition workflows."
      ],
      "owners": [
        "market-data"
      ],
      "claim_kind": "authority_boundary",
      "claim_lifecycle": "current",
      "registry_disposition": "partially_enforced",
      "activation_status": "unactivated",
      "activation_decision_refs": [],
      "activation_attestation_refs": [],
      "conformance": "static_aligned",
      "enforcement_maturity": "adequate",
      "proof_maturity": "partial",
      "proof_mode": "automated",
      "term_refs": [
        "QT-TERM-001"
      ],
      "authority_refs": [
        {
          "path": "docs/architecture/decisions/0050-use-one-canonical-append-only-market-data-store.md",
          "locator": {
            "kind": "line_range",
            "start": 41,
            "end": 57
          },
          "authority_kind": "decision_record",
          "source_lifecycle": "accepted",
          "role": "primary"
        }
      ],
      "enforcement_refs": [
        {
          "id": "QT-ENF-006",
          "kind": "structural_boundary",
          "path": "portal/backend/service/market/feed_service.py",
          "locator": {
            "kind": "line_range",
            "start": 117,
            "end": 525
          },
          "coverage": "complete"
        },
        {
          "id": "QT-ENF-007",
          "kind": "structural_boundary",
          "path": "portal/backend/service/storage/repos/market_data.py",
          "locator": {
            "kind": "line_range",
            "start": 2219,
            "end": 2241
          },
          "coverage": "supporting"
        }
      ],
      "finding_refs": [
        "ARCH-COVERAGE-001"
      ],
      "remediation_status": "pending",
      "remediation_refs": [],
      "replaced_by_ids": []
    },
    {
      "id": "QT-GUAR-FROZEN-DATASET-REPLAY",
      "candidate_refs": [
        {
          "id": "QT-GC-005",
          "relation": "equivalent"
        }
      ],
      "title": "Frozen Dataset deterministic replay",